{
  "category": "NONE",
  "crop": null,
  "description": {
    "en": "This weapon will not reach its full potential until it is brought to <color=#FFD201>Kudaai</color>."
  },
  "descriptionPlain": {
    "en": "This weapon will not reach its full potential until it is brought to Kudaai."
  },
  "icon": "icons/items/REPAIRED_WEAPON_GAUNTLETS.png",
  "id": "REPAIRED_WEAPON_GAUNTLETS",
  "meal": null,
  "name": {
    "en": "Claws of the Wolf"
  },
  "namePlain": {
    "en": "Claws of the Wolf"
  },
  "seed": null,
  "tags": [],
  "thumb": "icons/items/64/REPAIRED_WEAPON_GAUNTLETS.png",
  "usedIn": {
    "items": [],
    "rituals": [],
    "structures": []
  }
}
