{
  "category": "NONE",
  "crop": null,
  "description": {
    "ar": "حلوى لذيذة قشدية القوام.",
    "de": "Eine süße, cremige Leckerei.",
    "en": "A sweet, creamy treat.",
    "es": "Un manjar dulce y cremoso.",
    "fr": "Un petit plaisir doux et sucré.",
    "fr-CA": "Un délice crémeux et sucré.",
    "it": "Una delizia dolce e cremosa.",
    "ja": "甘くてクリーミーなスイーツ",
    "ko": "달콤하고 크림 가득한 간식.",
    "nl": "Een zoete, romige lekkernij.",
    "pt-BR": "Uma doce iguaria cremosa.",
    "ru": "Сладкое кремовое лакомство.",
    "tr": "Tatlı, krema kıvamında bir yiyecek.",
    "zh-CN": "香浓的奶油甜品。",
    "zh-TW": "香濃可口的甜品。"
  },
  "descriptionPlain": {
    "ar": "حلوى لذيذة قشدية القوام.",
    "de": "Eine süße, cremige Leckerei.",
    "en": "A sweet, creamy treat.",
    "es": "Un manjar dulce y cremoso.",
    "fr": "Un petit plaisir doux et sucré.",
    "fr-CA": "Un délice crémeux et sucré.",
    "it": "Una delizia dolce e cremosa.",
    "ja": "甘くてクリーミーなスイーツ",
    "ko": "달콤하고 크림 가득한 간식.",
    "nl": "Een zoete, romige lekkernij.",
    "pt-BR": "Uma doce iguaria cremosa.",
    "ru": "Сладкое кремовое лакомство.",
    "tr": "Tatlı, krema kıvamında bir yiyecek.",
    "zh-CN": "香浓的奶油甜品。",
    "zh-TW": "香濃可口的甜品。"
  },
  "icon": "icons/items/MEAL_SNOW_FRUIT.png",
  "id": "MEAL_SNOW_FRUIT",
  "meal": {
    "cookTime": 42.0,
    "dlc": true,
    "effects": [
      {
        "chance": 100,
        "description": {
          "ar": "<sprite name=\"icon_FaithUp\"> فرصة لأن يكتسب تابع سمة الدم الحار بنسبة <color=#FFD201>100%</color>.",
          "de": "<sprite name=\"icon_FaithUp\"> <color=#FFD201>100 %</color> Chance, dass ein Anhänger die Eigenschaft „Warmblüter“ erhält.",
          "en": "<sprite name=\"icon_FaithUp\"> <color=#FFD201>100%</color> chance of a Follower receiving the Warm Blooded Trait.",
          "es": "<sprite name=\"icon_FaithUp\"> <color=#FFD201>100 %</color> de probabilidad de que un adepto reciba el rasgo Sangre caliente.",
          "fr": "<sprite name=\"icon_FaithUp\"> <color=#FFD201>100 %</color> de chances que l'adepte reçoive la croyance « Sang chaud ».",
          "fr-CA": "<sprite name=\"icon_FaithUp\"> <color=#FFD201>100 %</color> de chances que l'adepte reçoive la croyance « Sang chaud ».",
          "it": "<sprite name=\"icon_FaithUp\"> <color=#FFD201>100%</color> di possibilità che un membro del Culto riceva il tratto Sangue caldo.",
          "ja": "<sprite name=\"icon_FaithUp\"> <color=#FFD201>100%</color>の確率で飲んだ信者が特性「熱血」を獲得する",
          "ko": "<sprite name=\"icon_FaithUp\"> <color=#FFD201>100%</color> 확률로 추종자가 열혈 특성을 얻습니다.",
          "nl": "<sprite name=\"icon_FaithUp\"> <color=#FFD201>100%</color> kans dat een volgeling de eigenschap warmbloedig krijgt.",
          "pt-BR": "<sprite name=\"icon_FaithUp\"> <color=#FFD201>100%</color> de chance de um Seguidor receber o Aspecto Sangue Quente.",
          "ru": "<sprite name=\"icon_FaithUp\"> Последователь получает особенность «Устойчивость к замерзанию» с вероятностью <color=#FFD201>100%</color>.",
          "tr": "<sprite name=\"icon_FaithUp\"> bir Takipçi <color=#FFD201>%100</color> ihtimalle Sıcakkanlı Özelliği kazanır.",
          "zh-CN": "<sprite name=\"icon_FaithUp\"> <color=#FFD201>100%</color> 几率使教徒获得暖血特质。",
          "zh-TW": "<sprite name=\"icon_FaithUp\"> <color=#FFD201>100%</color> 機率使教徒獲得暖血特質。"
        },
        "descriptionPlain": {
          "ar": "فرصة لأن يكتسب تابع سمة الدم الحار بنسبة 100%.",
          "de": "100 % Chance, dass ein Anhänger die Eigenschaft „Warmblüter“ erhält.",
          "en": "100% chance of a Follower receiving the Warm Blooded Trait.",
          "es": "100 % de probabilidad de que un adepto reciba el rasgo Sangre caliente.",
          "fr": "100 % de chances que l'adepte reçoive la croyance « Sang chaud ».",
          "fr-CA": "100 % de chances que l'adepte reçoive la croyance « Sang chaud ».",
          "it": "100% di possibilità che un membro del Culto riceva il tratto Sangue caldo.",
          "ja": "100%の確率で飲んだ信者が特性「熱血」を獲得する",
          "ko": "100% 확률로 추종자가 열혈 특성을 얻습니다.",
          "nl": "100% kans dat een volgeling de eigenschap warmbloedig krijgt.",
          "pt-BR": "100% de chance de um Seguidor receber o Aspecto Sangue Quente.",
          "ru": "Последователь получает особенность «Устойчивость к замерзанию» с вероятностью 100%.",
          "tr": "bir Takipçi %100 ihtimalle Sıcakkanlı Özelliği kazanır.",
          "zh-CN": "100% 几率使教徒获得暖血特质。",
          "zh-TW": "100% 機率使教徒獲得暖血特質。"
        },
        "type": "GivesWarmBloodedTrait"
      }
    ],
    "faith": 0,
    "recipes": [
      [
        {
          "item": "SNOW_FRUIT",
          "quantity": 1
        }
      ]
    ],
    "satiation": 100,
    "satiationPlayer": 75,
    "stars": 3,
    "tummyRating": 1.0
  },
  "name": {
    "ar": "حلوى فاكهة الجليد المثلجة",
    "de": "Schneefrucht-Eisbecher",
    "en": "Snow Fruit Sundae",
    "es": "Helado de fruta nívea",
    "fr": "Crème glacée au fruit des neiges",
    "fr-CA": "Sundae aux fruits des neiges",
    "it": "Coppa ai frutti d'inverno",
    "ja": "スノーフルーツサンデー",
    "ko": "눈열매 선데",
    "nl": "Sneeuwfruitijsje",
    "pt-BR": "Sorvete de Fruta Nevada",
    "ru": "Мороженое с ледфрутом",
    "tr": "Kar Meyveli Dondurma",
    "zh-CN": "雪果圣代",
    "zh-TW": "雪果聖代"
  },
  "namePlain": {
    "ar": "حلوى فاكهة الجليد المثلجة",
    "de": "Schneefrucht-Eisbecher",
    "en": "Snow Fruit Sundae",
    "es": "Helado de fruta nívea",
    "fr": "Crème glacée au fruit des neiges",
    "fr-CA": "Sundae aux fruits des neiges",
    "it": "Coppa ai frutti d'inverno",
    "ja": "スノーフルーツサンデー",
    "ko": "눈열매 선데",
    "nl": "Sneeuwfruitijsje",
    "pt-BR": "Sorvete de Fruta Nevada",
    "ru": "Мороженое с ледфрутом",
    "tr": "Kar Meyveli Dondurma",
    "zh-CN": "雪果圣代",
    "zh-TW": "雪果聖代"
  },
  "seed": null,
  "tags": [
    "meal"
  ],
  "thumb": "icons/items/64/MEAL_SNOW_FRUIT.png",
  "usedIn": {
    "items": [],
    "rituals": [],
    "structures": []
  }
}
