{
  "category": "NONE",
  "crop": null,
  "description": {},
  "descriptionPlain": {},
  "icon": "icons/items/FOUND_ITEM_DECORATION.png",
  "id": "FOUND_ITEM_DECORATION",
  "meal": null,
  "name": {
    "ar": "مخطط",
    "de": "Blaupause",
    "en": "Blueprint",
    "es": "Planos",
    "fr": "Plan",
    "fr-CA": "Le Plan",
    "it": "Schema",
    "ja": "設計図",
    "ko": "청사진",
    "nl": "Blauwdruk",
    "pt-BR": "Modelo",
    "ru": "Чертёж",
    "tr": "Taslak",
    "zh-CN": "蓝图",
    "zh-TW": "藍圖"
  },
  "namePlain": {
    "ar": "مخطط",
    "de": "Blaupause",
    "en": "Blueprint",
    "es": "Planos",
    "fr": "Plan",
    "fr-CA": "Le Plan",
    "it": "Schema",
    "ja": "設計図",
    "ko": "청사진",
    "nl": "Blauwdruk",
    "pt-BR": "Modelo",
    "ru": "Чертёж",
    "tr": "Taslak",
    "zh-CN": "蓝图",
    "zh-TW": "藍圖"
  },
  "seed": null,
  "tags": [],
  "thumb": "icons/items/64/FOUND_ITEM_DECORATION.png",
  "usedIn": {
    "items": [],
    "rituals": [],
    "structures": []
  }
}
