{
  "category": "NONE",
  "crop": null,
  "description": {
    "ar": "مكونات غنية مجهزة بإتقان.",
    "de": "Reich an Zutaten und perfekt zubereitet.",
    "en": "Rich ingredients, perfectly prepared.",
    "es": "Muy nutritivo, preparado a la perfección.",
    "fr": "Des ingrédients de qualité et une préparation maîtrisée.",
    "fr-CA": "Des ingrédients de qualité et une préparation maîtrisée.",
    "it": "Ingredienti ricchi, preparati alla perfezione.",
    "ja": "こだわりの材料を使い、完璧な調理が施された料理。",
    "ko": "재료도 풍부하고, 완벽하게 조리되었습니다.",
    "nl": "Rijke ingrediënten, perfect bereid.",
    "pt-BR": "Preparada perfeitamente com ingredientes ricos.",
    "ru": "Мастерски приготовленное блюдо из отборных ингредиентов.",
    "tr": "Kaliteli malzemeler, mükemmel bir yemek.",
    "zh-CN": "以味鲜浓郁的食材完美烹煮而成",
    "zh-TW": "以味鮮濃郁的食材完美烹煮而成"
  },
  "descriptionPlain": {
    "ar": "مكونات غنية مجهزة بإتقان.",
    "de": "Reich an Zutaten und perfekt zubereitet.",
    "en": "Rich ingredients, perfectly prepared.",
    "es": "Muy nutritivo, preparado a la perfección.",
    "fr": "Des ingrédients de qualité et une préparation maîtrisée.",
    "fr-CA": "Des ingrédients de qualité et une préparation maîtrisée.",
    "it": "Ingredienti ricchi, preparati alla perfezione.",
    "ja": "こだわりの材料を使い、完璧な調理が施された料理。",
    "ko": "재료도 풍부하고, 완벽하게 조리되었습니다.",
    "nl": "Rijke ingrediënten, perfect bereid.",
    "pt-BR": "Preparada perfeitamente com ingredientes ricos.",
    "ru": "Мастерски приготовленное блюдо из отборных ингредиентов.",
    "tr": "Kaliteli malzemeler, mükemmel bir yemek.",
    "zh-CN": "以味鲜浓郁的食材完美烹煮而成",
    "zh-TW": "以味鮮濃郁的食材完美烹煮而成"
  },
  "icon": "icons/items/MEAL_GREAT_FISH.png",
  "id": "MEAL_GREAT_FISH",
  "meal": {
    "cookTime": 42.0,
    "dlc": false,
    "effects": [
      {
        "chance": 25,
        "description": {
          "ar": "<sprite name=\"icon_FaithUp\"> فرصة لإسقاط موارد قيّمة بنسبة <color=#FFD201>25%</color>.",
          "de": "<sprite name=\"icon_FaithUp\"> <color=#FFD201>25 %</color> Chance, dass wertvolle Ressourcen hinterlassen werden.",
          "en": "<sprite name=\"icon_FaithUp\"> <color=#FFD201>25%</color> chance of dropping valuable resources.",
          "es": "<sprite name=\"icon_FaithUp\"> <color=#FFD201>25 %</color> de probabilidad de soltar recursos valiosos",
          "fr": "<sprite name=\"icon_FaithUp\"> <color=#FFD201>25 %</color> de chances de générer des ressources.",
          "fr-CA": "<sprite name=\"icon_FaithUp\"> <color=#FFD201>25 %</color> de chances de générer des ressources précieuses.",
          "it": "<sprite name=\"icon_FaithUp\"> <color=#FFD201>25%</color> di possibilità che il membro del Culto lasci cadere risorse preziose.",
          "ja": "<sprite name=\"icon_FaithUp\"> <color=#FFD201>25%</color>の確率で貴重な資源をドロップする",
          "ko": "<sprite name=\"icon_FaithUp\"> <color=#FFD201>25%</color>의 확률로 귀중한 자원을 떨어뜨립니다",
          "nl": "<sprite name=\"icon_FaithUp\"> <color=#FFD201>25%</color> kans op het uitscheiden van waardevolle grondstoffen.",
          "pt-BR": "<sprite name=\"icon_FaithUp\"> <color=#FFD201>25%</color> de chance de encontrar recursos valiosos",
          "ru": "<sprite name=\"icon_FaithUp\"> Последователь отдаёт ценные материалы с вероятностью <color=#FFD201>25%</color>.",
          "tr": "<sprite name=\"icon_FaithUp\"> <color=#FFD201>%25</color> ihtimalle değerli kaynaklar çıkar.",
          "zh-CN": "<sprite name=\"icon_FaithUp\"> <color=#FFD201>25%</color> 机率掉落贵重资源",
          "zh-TW": "<sprite name=\"icon_FaithUp\"> <color=#FFD201>25%</color> 機率掉落貴重資源"
        },
        "descriptionPlain": {
          "ar": "فرصة لإسقاط موارد قيّمة بنسبة 25%.",
          "de": "25 % Chance, dass wertvolle Ressourcen hinterlassen werden.",
          "en": "25% chance of dropping valuable resources.",
          "es": "25 % de probabilidad de soltar recursos valiosos",
          "fr": "25 % de chances de générer des ressources.",
          "fr-CA": "25 % de chances de générer des ressources précieuses.",
          "it": "25% di possibilità che il membro del Culto lasci cadere risorse preziose.",
          "ja": "25%の確率で貴重な資源をドロップする",
          "ko": "25%의 확률로 귀중한 자원을 떨어뜨립니다",
          "nl": "25% kans op het uitscheiden van waardevolle grondstoffen.",
          "pt-BR": "25% de chance de encontrar recursos valiosos",
          "ru": "Последователь отдаёт ценные материалы с вероятностью 25%.",
          "tr": "%25 ihtimalle değerli kaynaklar çıkar.",
          "zh-CN": "25% 机率掉落贵重资源",
          "zh-TW": "25% 機率掉落貴重資源"
        },
        "type": "DropLoot"
      },
      {
        "chance": 30,
        "description": {
          "ar": "<sprite name=\"icon_FaithUp\"> فرصة لتعافي تابع من المرض بنسبة <color=#FFD201>30%</color>.",
          "de": "<sprite name=\"icon_FaithUp\"> <color=#FFD201>30 %</color> Chance, dass sich ein kranker Anhänger von der Krankheit erholt.",
          "en": "<sprite name=\"icon_FaithUp\"> <color=#FFD201>30%</color> chance of a sick Follower recovering from illness.",
          "es": "<sprite name=\"icon_FaithUp\"> <color=#FFD201>30 %</color> de probabilidad de que un adepto enfermo se recupere",
          "fr": "<sprite name=\"icon_FaithUp\"> <color=#FFD201>30 %</color> de chances que l'adepte guérisse.",
          "fr-CA": "<sprite name=\"icon_FaithUp\"> <color=#FFD201>30 %</color> de chances que l'adepte guérisse.",
          "it": "<sprite name=\"icon_FaithUp\"> <color=#FFD201>30%</color> di possibilità che il membro del Culto guarisca dalla malattia.",
          "ja": "<sprite name=\"icon_FaithUp\"> <color=#FFD201>30%</color>の確率で信者の病気が治る",
          "ko": "<sprite name=\"icon_FaithUp\"> <color=#FFD201>30%</color>의 확률로 병든 추종자가 병을 이겨냅니다.",
          "nl": "<sprite name=\"icon_FaithUp\"> <color=#FFD201>30%</color> kans dat een zieke volgeling geneest.",
          "pt-BR": "<sprite name=\"icon_FaithUp\"> <color=#FFD201>30%</color> de chance de um seguidor doente se recuperar de uma doença",
          "ru": "<sprite name=\"icon_FaithUp\"> Больной последователь выздоравливает с вероятностью <color=#FFD201>30%</color>.",
          "tr": "<sprite name=\"icon_FaithUp\"> Hasta bir Takipçi <color=#FFD201>%30</color> ihtimalle iyileşir.",
          "zh-CN": "<sprite name=\"icon_FaithUp\"> <color=#FFD201>30%</color> 机率使生病的教徒康复",
          "zh-TW": "<sprite name=\"icon_FaithUp\"> <color=#FFD201>30%</color> 機率使生病的教徒康復"
        },
        "descriptionPlain": {
          "ar": "فرصة لتعافي تابع من المرض بنسبة 30%.",
          "de": "30 % Chance, dass sich ein kranker Anhänger von der Krankheit erholt.",
          "en": "30% chance of a sick Follower recovering from illness.",
          "es": "30 % de probabilidad de que un adepto enfermo se recupere",
          "fr": "30 % de chances que l'adepte guérisse.",
          "fr-CA": "30 % de chances que l'adepte guérisse.",
          "it": "30% di possibilità che il membro del Culto guarisca dalla malattia.",
          "ja": "30%の確率で信者の病気が治る",
          "ko": "30%의 확률로 병든 추종자가 병을 이겨냅니다.",
          "nl": "30% kans dat een zieke volgeling geneest.",
          "pt-BR": "30% de chance de um seguidor doente se recuperar de uma doença",
          "ru": "Больной последователь выздоравливает с вероятностью 30%.",
          "tr": "Hasta bir Takipçi %30 ihtimalle iyileşir.",
          "zh-CN": "30% 机率使生病的教徒康复",
          "zh-TW": "30% 機率使生病的教徒康復"
        },
        "type": "RemovesIllness"
      }
    ],
    "faith": 3,
    "recipes": [
      [
        {
          "item": "FISH_SQUID",
          "quantity": 1
        },
        {
          "item": "FISH_OCTOPUS",
          "quantity": 1
        },
        {
          "item": "FISH_BLOWFISH",
          "quantity": 1
        },
        {
          "item": "FISH_SWORDFISH",
          "quantity": 1
        }
      ]
    ],
    "satiation": 100,
    "satiationPlayer": 75,
    "stars": 3,
    "tummyRating": 1.0
  },
  "name": {
    "ar": "وجبة أسماك شهية عامرة",
    "de": "Köstliches Fischfestmahl",
    "en": "Delicious Fish Feast",
    "es": "Festín de pescado delicioso",
    "fr": "Succulent plat de poisson",
    "fr-CA": "Succulent plat de poisson",
    "it": "Leccornia di pesce",
    "ja": "上質な魚料理",
    "ko": "아주 맛있는 물고기 음식",
    "nl": "Heerlijk visfeestmaal",
    "pt-BR": "Banquete de Peixe Delicioso",
    "ru": "Изысканное рыбное ассорти",
    "tr": "Nefis Balık Şöleni",
    "zh-CN": "美味鱼盛宴",
    "zh-TW": "美味魚盛宴"
  },
  "namePlain": {
    "ar": "وجبة أسماك شهية عامرة",
    "de": "Köstliches Fischfestmahl",
    "en": "Delicious Fish Feast",
    "es": "Festín de pescado delicioso",
    "fr": "Succulent plat de poisson",
    "fr-CA": "Succulent plat de poisson",
    "it": "Leccornia di pesce",
    "ja": "上質な魚料理",
    "ko": "아주 맛있는 물고기 음식",
    "nl": "Heerlijk visfeestmaal",
    "pt-BR": "Banquete de Peixe Delicioso",
    "ru": "Изысканное рыбное ассорти",
    "tr": "Nefis Balık Şöleni",
    "zh-CN": "美味鱼盛宴",
    "zh-TW": "美味魚盛宴"
  },
  "seed": null,
  "tags": [
    "meal"
  ],
  "thumb": "icons/items/64/MEAL_GREAT_FISH.png",
  "usedIn": {
    "items": [],
    "rituals": [],
    "structures": []
  }
}
