{
  "category": "NONE",
  "crop": null,
  "description": {
    "ar": "عليك إعادة هذا إلى <color=#FFD201>ملاذ الحملان</color>.",
    "de": "Bringe sie nach <color=#FFD201>Wollhafen</color> zurück.",
    "en": "Return this to <color=#FFD201>Woolhaven</color>.",
    "es": "Llévala a <color=#FFD201>Vellones Elíseos</color>.",
    "fr": "Ramenez cet objet à <color=#FFD201>Havrelaine</color>.",
    "fr-CA": "Ramenez cet objet à <color=#FFD201>Havrelaine</color>.",
    "it": "Restituiscila all'<color=#FFD201>Aldilàna</color>.",
    "ja": "<color=#FFD201>羊毛の聖域</color>まで持っていこう",
    "ko": "<color=#FFD201>포근쉼터</color>로 가져가세요.",
    "nl": "Breng dit terug naar <color=#FFD201>Wolhaven</color>.",
    "pt-BR": "Devolva para <color=#FFD201>Santa Lã</color>.",
    "ru": "Клок шерсти, который нужно принести в <color=#FFD201>Шерстополь</color>.",
    "tr": "Bunu <color=#FFD201>Yüntepe</color>'ye geri götür.",
    "zh-CN": "将这件东西带到<color=#FFD201>羊绒仙境</color>。",
    "zh-TW": "將羊毛帶回<color=#FFD201>羊絨仙境</color>。"
  },
  "descriptionPlain": {
    "ar": "عليك إعادة هذا إلى ملاذ الحملان.",
    "de": "Bringe sie nach Wollhafen zurück.",
    "en": "Return this to Woolhaven.",
    "es": "Llévala a Vellones Elíseos.",
    "fr": "Ramenez cet objet à Havrelaine.",
    "fr-CA": "Ramenez cet objet à Havrelaine.",
    "it": "Restituiscila all'Aldilàna.",
    "ja": "羊毛の聖域まで持っていこう",
    "ko": "포근쉼터로 가져가세요.",
    "nl": "Breng dit terug naar Wolhaven.",
    "pt-BR": "Devolva para Santa Lã.",
    "ru": "Клок шерсти, который нужно принести в Шерстополь.",
    "tr": "Bunu Yüntepe'ye geri götür.",
    "zh-CN": "将这件东西带到羊绒仙境。",
    "zh-TW": "將羊毛帶回羊絨仙境。"
  },
  "icon": "icons/items/SPECIAL_WOOL_LAMBWAR.png",
  "id": "SPECIAL_WOOL_LAMBWAR",
  "meal": null,
  "name": {
    "ar": "صوف العالمة",
    "de": "Wolle der Gelehrten",
    "en": "Wool of the Scholar",
    "es": "Lana de la Erudita",
    "fr": "Laine de l'érudite",
    "fr-CA": "Laine de l'érudite",
    "it": "Lana dell'erudita",
    "ja": "学者のウール",
    "ko": "학자의 모직",
    "nl": "Wol van de geleerde",
    "pt-BR": "Pelagem da Erudição",
    "ru": "Шерсть учёной",
    "tr": "Âlimin Yünü",
    "zh-CN": "学者羊毛",
    "zh-TW": "學者羊毛"
  },
  "namePlain": {
    "ar": "صوف العالمة",
    "de": "Wolle der Gelehrten",
    "en": "Wool of the Scholar",
    "es": "Lana de la Erudita",
    "fr": "Laine de l'érudite",
    "fr-CA": "Laine de l'érudite",
    "it": "Lana dell'erudita",
    "ja": "学者のウール",
    "ko": "학자의 모직",
    "nl": "Wol van de geleerde",
    "pt-BR": "Pelagem da Erudição",
    "ru": "Шерсть учёной",
    "tr": "Âlimin Yünü",
    "zh-CN": "学者羊毛",
    "zh-TW": "學者羊毛"
  },
  "seed": null,
  "tags": [],
  "thumb": "icons/items/64/SPECIAL_WOOL_LAMBWAR.png",
  "usedIn": {
    "items": [],
    "rituals": [],
    "structures": []
  }
}
